{
  "formatVersion": "1",
  "id": "desktop-pet.web.skill",
  "name": "按目标与兴趣探索网页",
  "version": "1.0.0",
  "summary": "围绕问题或兴趣搜索网页，判断来源并分段阅读，自行选择继续、改词、结束或等待",
  "instructions": "SKILL.md",
  "dependencies": [
    {
      "kind": "tool",
      "id": "desktop-pet.web.tools",
      "version": "1.0.0",
      "operations": ["status", "search", "read_page"],
      "required": true
    }
  ]
}
